"id","Name","Age","catInfo","Win","Loss","Image"
"1","Cat McTerror","3","Very loud","23","6","cat1.png"
"2","Caterson CatSpyder Silva","5","Slim, broke leg in past years","35","15","cat02.png"
"3","Firko Cro Cat","5","Past his prime, doing seminars","38","13","cat03.png"
"4","Catbib Furwmagomedov","2","Current champion, wrestle and catmbo","28","2","cat04.png"
"5","Kit Kitty Kones","3","Bad kitty, loves to use dog food better strength","27","4","cat05.png"
"6","Roy BigCat Meowson","5","Big kitty, loves to fight","24","19","cat06.png"
"8","big boi","3","big chonk","3","5","bigboi.png"
